id,org_name,created,modified,name,type,description,category,snippet,categories,accessInformation,licenseInfo,culture,url,access,license,organization,extent,industries
ca3ec13e288a4282a9ae06fbdcecce0a,PPACG_GIS1,"Thu, 21 Mar 2024 16:41:57 GMT","Thu, 06 Feb 2025 21:31:19 GMT",PPACG Traffic Crashes (2019-2023),Feature Service,"The Traffic Crashes feature layer models roadway traffic crashes within the Pikes Peak Area Council of Governments (PPACG) region, typically over a five-year period. This data is developed from crash data records compiled by CDOT from police accident reports filed with the state by each jurisdiction in the region. CDOT consolidates the police reports into a single database, removes personal identifying information, and then provides PPACG with an exported table of crash data records. The majority of the crash records (greater than 99.99%) are successfully linear referenced to routes or geocoded to address information acquired from CDOT, the El Paso-Teller County E911 Authority, and Park County. All crash records associated with roadways modeled in PPACG's Route Centerlines feature class are further refined by PPACG to align with coincident roadway network links and intersections. The 'Crash_ID' field stores the unique ID value for each feature in this data set, and is derived as a concatenation of the crash year and the 'CUID' CDOT crash database identifier field. The 'CUID' field is provided by CDOT in their crash data deliverable, and may not be unique. The 'RouteCL_ID' field, the ‘NetLink_ID' field, and the 'Intrsct_ID' fields record the foreign keys for any related features in PPACG's respective Route Centerlines, Roadway Network Links, and Roadway Network Intersections feature classes. The ‘Severity’ field categorizes each crash according to the severity of injuries or resultant fatalities, if any, as reported in the crash data. The 'Date_Time' field stores the concatenated crash date and crash time from each report into a single date field, while the 'Day' field records the day of the week of each crash. The 'DriveImp_1', 'DriveImp_2', and 'NM_Imp' fields identify if the drivers or non-motorist involved in each crash was suspected of drug or alcohol impairment according to the crash record, which may have included field sobriety testing. Those fields are not updated with the results of any further tests or other conclusive measures that may have been performed after the crash report was filed. All remaining fields are derived directly from CDOT crash data records, altered by PPACG to provide descriptive and consistent field names and aliases that still logically reference the original CDOT crash data schema, and primarily describe the location, roadway features, conditions, vehicle information, and driver actions documented with each crash record.","Crash,Traffic,Safety","The Traffic Crashes feature layer is a point model of roadway traffic crashes within the Pikes Peak Area Council of Governments (PPACG) region, and was primarily developed to help with regional safety planning and mapping projects related to these features.","/Categories/Transportation/Performance and Utilization,/Categories/Health and Safety","CDOT, DiExSys, El Paso-Teller 911 Authority","This data, information, or mapping product (""product"") is made available by the Pikes Peak Area Council of Governments (PPACG) as a public service. While PPACG strives to make this product as accurate as possible, it is for general informational purposes only and has not been prepared for legal, engineering, or surveying purposes. PPACG provides this product ""as is"" with no warranties of any kind, either express or implied, including, but not limited to, warranties of title or implied warranties of merchantability or fitness for a particular purpose. PPACG shall not be liable for any direct, indirect, incidental, special, or consequential damages arising out of the use of this product, or the inability to use this product, or out of any breach of any warranty. The user acknowledges and agrees that the use of this product is at the sole risk of the user.",en-us,https://services1.arcgis.com/0plDVQODvYjBRQXP/arcgis/rest/services/PPACG_Traffic_Crashes/FeatureServer,public,custom,Pikes Peak Area Council of Governments,"-106.14383723563513,38.50998428442321,-104.04136591233548,39.56209187796736",
048da3d1818b4d0b95ec526b9e642719,pryan_LivingAtlas,"Wed, 12 Jan 2022 21:47:37 GMT","Wed, 05 Feb 2025 19:50:17 GMT",Ookla Speedtest for Global Broadband Performance,Feature Service,"About Speedtest data is used today by commercial fixed and mobile network operators around the world to inform network buildout, improve global Internet quality, and increase Internet accessibility. Government regulators such as the United States Federal Communications Commission and the Malaysian Communications and Multimedia Commission use Speedtest data to hold telecommunications entities accountable and direct funds for rural and urban connectivity development. Ookla licenses data to NGOs and educational institutions to fulfill its mission: to help make the internet better, faster and more accessible for everyone. Ookla hopes to further this mission by distributing the data to make it easier for individuals and organizations to use it for the purposes of bridging the social and economic gaps between those with and without modern Internet access. Data Overview Tiles Hundreds of millions of Speedtests are taken on the Ookla platform each month. In order to create a manageable dataset, we aggregate raw data into tiles. The size of a data tile is defined as a function of ""zoom level"" (or ""z""). At z=0, the size of a tile is the size of the whole world. At z=1, the tile is split in half vertically and horizontally, creating 4 tiles that cover the globe. This tile-splitting continues as zoom level increases, causing tiles to become exponentially smaller as we zoom into a given region. By this definition, tile sizes are actually some fraction of the width/height of Earth according to Web Mercator projection (EPSG:3857). As such, tile size varies slightly depending on latitude, but tile sizes can be estimated in meters. For the purposes of these layers, a zoom level of 16 (z=16) is used for the tiling. This equates to a tile that is approximately 610.8 meters by 610.8 meters at the equator (18 arcsecond blocks). The geometry of each tile is represented in WGS 84 (EPSG:4326) in the tile field. The data can be found at: https://github.com/teamookla/ookla-open-data Update Cadence The tile aggregates start in Q1 2019 and go through the most recent quarter. They will be updated shortly after the conclusion of the quarter. Esri Processing This layer is a best available aggregation of the original Ookla dataset. This means that for each tile that data is available, the most recent data is used. So for instance, if data is available for a tile for Q2 2019 and for Q4 2020, the Q4 2020 data is awarded to the tile. The default visualization for the layer is the ""broadband index"". The broadband index is a bivariate index based on both the average download speed and the average upload speed. For Mobile, the score is indexed to a standard of 35 megabits per second (Mbps) download and 3 Mbps upload. A tile with average Speedtest results of 25/3 Mbps is awarded 100 points. Tiles with average speeds above 25/3 are shown in green, tiles with average speeds below this are shown in fuchsia. For Fixed, the score is indexed to a standard of 100 Mbps download and 3 Mbps upload. A tile with average Speedtest results of 100/20 Mbps is awarded 100 points. Tiles with average speeds above 100/20 are shown in green, tiles with average speeds below this are shown in fuchsia. Tile Attributes Each tile contains the following attributes: The year and the quarter that the tests were performed. The average download speed of all tests performed in the tile, represented in megabits per second. The average upload speed of all tests performed in the tile, represented in megabits per second. The average latency of all tests performed in the tile, represented in milliseconds The number of tests taken in the tile. The number of unique devices contributing tests in the tile. The quadkey representing the tile. Quadkeys Quadkeys can act as a unique identifier for the tile. This can be useful for joining data spatially from multiple periods (quarters), creating coarser spatial aggregations without using geospatial functions, spatial indexing, partitioning, and an alternative for storing and deriving the tile geometry. Layers There are two layers: Ookla_Mobile_Tiles - Tiles containing tests taken from mobile devices with GPS-quality location and a cellular connection type (e.g. 4G LTE, 5G NR). Ookla_Fixed_Tiles - Tiles containing tests taken from mobile devices with GPS-quality location and a non-cellular connection type (e.g. WiFi, ethernet). The layers are set to draw at scales 1:3,000,000 and larger. Time Period and Update Frequency Layers are generated based on a quarter year of data (three months) and files will be updated and added on a quarterly basis. A year=2020/quarter=1, the first quarter of the year 2020, would include all data generated on or after 2020-01-01 and before 2020-04-01. Data is subject to be reaggregated regularly in order to honor Data Subject Access Requests (DSAR) as is applicable in certain jurisdictions under laws including but not limited to General Data Protection Regulation (GDPR), California Consumer Privacy Act (CCPA), and Lei Geral de Proteção de Dados (LGPD). Therefore, data accessed at different times may result in variation in the total number of tests, tiles, and resulting performance metrics.","Ookla,Speedtest,Global,Fixed,Mobile,Network Performance,Broadband,Policy,Infrastructure,Telecommunications,Telecom","This dataset provides global fixed broadband and mobile (cellular) network performance metrics in zoom level 16 web mercator tiles (approximately 610.8 meters by 610.8 meters at the equator). Data is projected in EPSG:4326. Download speed, upload speed, and latency are collected via the Speedtest by Ookla applications for Android and iOS and averaged for each tile. Measurements are filtered to results containing GPS-quality location accuracy. The data was processed and published to ArcGIS Living Atlas by Esri and is inclusive of the Q4 2024 data download.",,"Ookla Open Data, https://github.com/teamookla/ookla-open-data",Creative Commons Attribution-NonCommercial-ShareAlike 4.0 International (CC BY-NC-SA 4.0) This work is licensed under the Esri Master License Agreement. View Summary | View Terms of Use,en-us,https://services.arcgis.com/jIL9msH9OI208GCb/arcgis/rest/services/Speedtest_by_Ookla_Global_Fixed_and_Mobile_Network_Performance_Map_Tiles/FeatureServer,public,CC-BY-NC-SA-4.0,ArcGIS Living Atlas Team,"-179.999987937519,-84.4374447344626,179.999987937519,84.60474255870692",
3a6f0a8c21194d73908b1d1e3bc932af,PPACG_GIS_Admin,"Mon, 12 Jul 2021 20:03:28 GMT","Tue, 04 Feb 2025 17:10:56 GMT",PPACG Route Centerlines,Feature Service,"The Route Centerlines feature layer models the administrative
and planning attributes of those roadway traffic routes which are functionally
classified with the FHWA or otherwise included in the regional travel demand
model for the Pikes Peak Area Council of Governments (PPACG) region. The data in this feature class is developed by PPACG from information provided by or acquired from the Colorado Department of Transportation (CDOT), National Highway System (NHS) data distributed by the Bureau of Transportation Statistics as part of the National Transportation Atlas Database, local jurisdictions within the region, and aerial imagery. The 'RouteCL_ID' field stores the primary key and unique ID values for each feature in this data set. The 'Route_Name' field identifies the recorded name according to the owner of each route segment, while the 'Alt_Name' field identifies any additional names or aliases assigned to that route segment. The 'Owner' field identifies the legal entity which owns, or is eligible to receive appropriate ownership tax revenue for, the roadway modeled by each route segment, and is typically derived from the state's Highway Use Tax Fund (HUTF) records. The 'FClassFed' field records the federally recognized functional classification for each route segment according to the Federal Highway Administration (FHWA), while the 'FClasOwner' field describes any secondary functional class descriptions applied by the owner of each route segment. The 'NHS_Cat' field identifies the component category for those routes included in the National Highway System (NHS), the 'STRAHNET' field records a route segment's classification on the Strategic Highway Network, and the 'Frght_Corr' field identifies if the route segment is part of a designated regional, state, or national freight corridor. Fields with the 'CMP' prefix record planning corridor designations as defined in the current regional Congestion Management Process. The remaining fields store data pertinent to PPACG's planning operations, and primarily describe the location, operational, and physical attributes of each route. The source of each feature's geometry and spatial definition is identified in the 'Geo_Source' field. The 'Geo_Edit' field describes any geometry edits that were made to alter the source data, such as adjustments to maintain consistency with neighboring data or imagery.","Centerline,Roadway,Route,Functional Class,Highway,Interstate,Arterial,Collector","The Route Centerlines feature layer is a polyline model of roadway traffic routes within the Pikes Peak Area Council of Governments (PPACG) region, and was primarily developed to help with regional planning and mapping projects related to these features.",/Categories/Transportation/Infrastructure,"CDOT, Bureau of Transportation Statistics, Federal Highway Administration, El Paso County, Teller County, Park County, City of Colorado Springs, City of Fountain, Microsoft Bing Imagery, Esri","This  data, information, or mapping product (""product"") is made available by  the Pikes Peak Area Council of Governments (PPACG) as a public service.  While PPACG strives to make this product as accurate as possible, it is  for general informational purposes only and has not been prepared for  legal, engineering, or surveying purposes. PPACG provides this product  ""as is"" with no warranties of any kind, either express or implied,  including, but not limited to, warranties of title or implied warranties  of merchantability or fitness for a particular purpose. PPACG shall not  be liable for any direct, indirect, incidental, special, or  consequential damages arising out of the use of this product, or the  inability to use this product, or out of any breach of any warranty. The  user acknowledges and agrees that the use of this product is at the  sole risk of the user.",en-us,https://services1.arcgis.com/0plDVQODvYjBRQXP/arcgis/rest/services/PPACG_Route_Centerlines/FeatureServer,public,custom,Pikes Peak Area Council of Governments,"-106.18610699889315,38.51416308940967,-104.03500975740846,39.565134232835696",
e143f436d4774402aa8cca1e663b1d24,USDOT_BTS,"Tue, 10 Sep 2024 15:03:53 GMT","Mon, 03 Feb 2025 22:27:54 GMT",North American Rail Network Lines,Feature Service,"The North American Rail Network (NARN) Rail Lines dataset was created in 2016 and was updated on January 29, 2025 from the Federal Railroad Administration (FRA) and is part of the U.S. Department of Transportation (USDOT)/Bureau of Transportation Statistics (BTS) National Transportation Atlas Database (NTAD). The NARN Rail Lines dataset is a database that provides ownership, trackage rights, type, passenger, STRACNET, and  geographic reference for North America's railway system at 1:24,000 or better within the United States. The data set covers all 50 States, the District of Columbia, Mexico, and Canada. A data dictionary, or other source of attribute information, is accessible at https://doi.org/10.21949/1528950","USA,National,North America,NTAD,National Transportation Atlas Database,Transportation,Atlas,Database,vector,line,linear Rail,NARN,Network,Lines","North American Rail Network (NARN) can be used within the public, the federal government, rail industry, state DOTs, and academia for routing, mapping and analysis.",,Acknowledgment of the Federal Railroad Administration (FRA) and the Bureau of Transportation Statistics (BTS) [distributor].,This NTAD dataset is a work of the United States government as defined in 17 U.S.C. § 101 and as such are not protected by any U.S. copyrights. This work is available for unrestricted public use.,,https://services.arcgis.com/xOi1kZaI0eWDREZv/arcgis/rest/services/NTAD_North_American_Rail_Network_Lines/FeatureServer,public,custom,Federal Railroad Administration (FRA),"-156.689772,14.672258,-59.927231,64.926145",
